{
  "schema_version": 2,
  "issue_id": "2026-09-07",
  "publication_date": "2026-09-07",
  "visibility": "published_preview",
  "timezone": "Asia/Shanghai",
  "candidate_created_at": "2026-09-07T11:22:45+08:00",
  "research_locked_at": "2026-09-07T11:32:00+08:00",
  "content_locked_at": "2026-09-07T11:32:00+08:00",
  "status": "BLOCKED",
  "media_required": true,
  "contract": {"repository":"GUAiZzz/culture-taste-daily","path":"docs/PRODUCTION_CONTRACT_V3.md","commit":"83982d543bb845819b3412cd5b10b273ec3fcf25","activation_commit":"da3842bcd72b6966a35826a38b737f12c9042667"},
  "core_version": "v2",
  "content_lock": {"status":"locked","sha256":"a2f77e9e8a2e48a74be8e0cd842eae577d06ce2fb0104abae4cde0a9b9f3dc19","locked_at":"2026-09-07T11:32:00+08:00"},
  "source_hashes": {"content_sha256":"a2f77e9e8a2e48a74be8e0cd842eae577d06ce2fb0104abae4cde0a9b9f3dc19","art_direction_sha256":"5e496b90dcd5be78efc3f8f3a43feafed8826f48e5a21c3efbc6dd3081e28b1d","issue_style_sha256":"273d17e9d2f643ffe3644c9f45eeeab8d12cc16ff5ef5ac38051b3491286b057"},
  "harrytone": {"repository":"GUAiZzz/harry-tone","branch":"main","commit":"13cd6b7046bd81be396810d2923f3a5dc818e93f","loaded_at":"2026-09-07T11:07:45+08:00"},
  "language_mode": "zh-CN_full__en_title_deck_abstract",
  "editorial_position": "文化体验在打开页面之前就已经开始：日期、时段、地点和下一次入口把兴趣变成可行动的公共安排。节目表不是附录，它决定观众能否真正进入现场。",
  "art_direction": {
    "dominant_mood": "奶油黄纸面上的蓝色时间刻度、品红批注和薄荷绿空档",
    "background_logic": "把页面当成一张被折开的节目表：横向日期线承载入口，纵向空档承载停留，不复用最近七期的路线箭头、工作台、测量脊、门槛线、倒计时网格、脚手架或互穿曲线",
    "palette_logic": "butter #FFF4C7, navy #111827, electric blue #0047FF, magenta #D12B6A, mint #BCE8D3；蓝色负责时间秩序，品红标记选择，薄荷绿只负责留白和转场",
    "type_scale_logic": "标题像印在总节目表边缘的大号栏目名，正文 18px；故事编号沿时间线固定，英文只承担标题、deck 与 abstract",
    "image_behavior": "三张一手官方媒体只在 Preview 外链显示；本地 entry-card SVG 是原创的日程图，不冒充纪实照片",
    "page_density_and_tempo": "封面先给出一条未填满的日期轴，正文依次从八天、九天与三个月的安排进入，退出处把日程还给下一步行动",
    "core_visual_action": "页面把日期、地点、时段、参与者和进入条件排成可回查的时间刻度，让文化判断停在可行动的条件而不是活动数量",
    "cover_composition": "奶油黄底上横置一条深蓝时间轴，蓝色大刻度切开日期，品红方块像已选入口，薄荷绿空格保留尚未发生的现场",
    "desktop_interaction_mechanic": "原生索引、来源锚点与外链常驻，所有事实、正文与来源不依赖 JavaScript",
    "behance_viewing_arc": "从北京的八天产业编排进入伦敦的城市多入口，再进入香港把多种声音排进秋天的节目表，最后退出到下一步行动",
    "mobile_translation": "390px 下时间轴折为右侧窄栏，品红选择标记变成边缘标签，正文保持单列并允许来源长链接换行",
    "mobbin_usability_constraint": "交互目标不少于 44px，焦点可见，长链接换行，外图失败不隐藏来源，移动端无横向滚动",
    "quiet_ending": "退出处留下一个未填满的薄荷绿时段，提醒日程的价值是把下一次行动留给读者",
    "closing_quotation": {"id":"ct-en-003","language":"en","text":"A deadline earns meaning when it makes the next action visible.","credit":"Culture & Taste Editorial"},
    "closing_palette": {"background":"#FFF4C7","foreground":"#111827","accent":"#0047FF","rationale":"奶油黄保留纸面与日历的轻感，深蓝确保正文和刻度清楚，电光蓝在浅底上保持高对比并承担时间秩序；品红、薄荷绿只作大面积视觉标记，不承担小字号文字。"}
  },
  "variation_review": {"comparison_mode":"prior_issues","compared_issue_dates":["2026-08-30","2026-08-31","2026-09-01","2026-09-02","2026-09-03","2026-09-04","2026-09-06"],"repeated_mechanisms":["accessible section index","first-party source image with linked fallback"],"exception_reason":"可访问索引与一手来源图是固定约束；本期以横向日期刻度、折开的节目表、品红选择块和薄荷绿空档作为核心构图，没有复用最近七期的路线箭头、工作台、测量脊、门槛线、倒计时网格、脚手架或互穿曲线。"},
  "stories": [
    {"id":"china-fashion-week-autumn","level":"cover","title":"北京时装周：八天不是背景","sources":[{"title":"金序东方，潮启共生——2026中国国际时装周（秋季）盛大启幕","publisher":"中国纺织工业联合会","url":"https://www.cntac.org.cn/zixun/hangye/202609/t20260904_4420466.html","published_date":"2026-09-04","event_date":"2026-09-03/2026-09-10","relationship":"first_party_official"}],"image_credit":"中国纺织工业联合会官方开幕图片 / Preview-linked","english":{"title":"THE CALENDAR IS PART OF THE WORK","deck":"Beijing's fashion week makes its industrial and public entrances visible across eight days.","abstract":"The official release fixes the eight-day programme, 220-plus brands, venues and retail-facing formats. The reading of the calendar as public infrastructure is editorial interpretation, not a claim about event quality or conversion."},"media":{"asset":"assets/entry-card.svg","alt":"中国国际时装周秋季官方开幕图","caption":"中国纺织工业联合会官方图片；打开来源页查看活动日期、地点与节目结构。","credit":"中国纺织工业联合会 · Preview-linked official image","kind":"source_image","origin_url":"https://www.cntac.org.cn/zixun/hangye/202609/t20260904_4420466.html","external_image_url":"https://www.cntac.org.cn/zixun/hangye/202609/W020260904485112730744.png","origin_authority":"first_party_official","rights_basis":"preview_user_authorized_external"}},
    {"id":"london-design-festival-awakenings","level":"major","title":"伦敦设计节：城市被写成多条入口","sources":[{"title":"London Design Festival","publisher":"London Design Festival","url":"https://londondesignfestival.com/","published_date":null,"event_date":"2026-09-12/2026-09-20","relationship":"first_party_official"},{"title":"V&A x LDF: Awakenings","publisher":"Victoria and Albert Museum","url":"https://www.vam.ac.uk/festival/2026/london-design-festival-2026","published_date":null,"event_date":"2026-09-12/2026-10-18","relationship":"first_party_official"}],"image_credit":"V&A 官方项目图片 / Preview-linked","english":{"title":"A CITY WRITTEN IN ENTRANCES","deck":"London Design Festival turns districts, institutions and dates into a navigable public programme.","abstract":"The festival homepage fixes 12–20 September 2026, the 24th edition and 11 design districts; V&A fixes Awakenings from 12 September with free displays continuing into October. The claim that a calendar changes how a city is entered is editorial interpretation."},"media":{"asset":"assets/entry-card.svg","alt":"V&A x LDF Awakenings 官方项目图片","caption":"V&A 官方项目图片；打开页面查看展陈、开放时间和免费入场信息。","credit":"Victoria and Albert Museum · Preview-linked official image","kind":"source_image","origin_url":"https://www.vam.ac.uk/festival/2026/london-design-festival-2026","external_image_url":"https://vanda-production-assets.s3.amazonaws.com/2025/06/23/11/12/36/b8fe720b-59e5-4b3c-9088-ebf4c9fe534f/SainsburyGallery.jpg","origin_authority":"first_party_official","rights_basis":"preview_user_authorized_external"}},
    {"id":"asia-plus-festival","level":"signal","title":"亚洲+：声音先被排进秋天","sources":[{"title":"Fourth Asia+ Festival to open in September to showcase a mixture of traditional and contemporary elements with new cross-disciplinary interpretations","publisher":"Leisure and Cultural Services Department","url":"https://www.lcsd.gov.hk/clpss/en/webApp/NewsDetails.do?id=21347","published_date":"2026-07-16","event_date":"2026-09/2026-11","relationship":"first_party_official"},{"title":"LCSD e-Magazine current programme highlights","publisher":"Leisure and Cultural Services Department","url":"https://www.lcsd.gov.hk/en/emagazine/current.html","published_date":"2026-09-07","event_date":"2026-09/2026-11","relationship":"first_party_official"}],"image_credit":"香港政府新闻处官方图片 / Preview-linked","english":{"title":"SOUND IS SCHEDULED BEFORE IT IS HEARD","deck":"Asia+ Festival lays cross-border music and interdisciplinary performance across a three-month public calendar.","abstract":"LCSD fixes the September–November run, participation from more than 30 countries and regions, over 100 performances and the 23–24 September opening concert. The reading of scheduling as an invitation to choose an entry point is editorial interpretation."},"media":{"asset":"assets/entry-card.svg","alt":"Asia+ Festival 2026 官方节目简报图片","caption":"香港政府新闻处官方图片；打开官方新闻稿查看节目、日期和参与者。","credit":"Hong Kong Government Information Services · Preview-linked official image","kind":"source_image","origin_url":"https://www.lcsd.gov.hk/clpss/en/webApp/NewsDetails.do?id=21347","external_image_url":"https://gia.info.gov.hk/general/202607/16/P2026071500704_photo_1333322.jpg","origin_authority":"first_party_official","rights_basis":"preview_user_authorized_external"}}
  ],
  "rights_summary": {"required_assets":3,"unknown_required_assets":3,"status":"blocked"},
  "artifact_digests": {"issue_payload_sha256":null},
  "evidence_refs": {"technical":[],"editorial_visual":[],"gate":[]},
  "qa": {"html_parse":"pass","assets":"pass","internal_links":"pass","no_js_reading":"pass","desktop_render":"pass","mobile_render":"pass","reduced_motion":"pass"},
  "limitations": ["Non-production Preview candidate only; this manifest cannot authorize production deployment.","Canonical private GUAiZzz/harry-tone main was verified at pinned commit 13cd6b7046bd81be396810d2923f3a5dc818e93f; no private material enters this repository.","All selected stories use externally hosted first-party official images. Reuse rights remain unknown, so candidate status stays BLOCKED and Preview displays source links with a local non-documentary fallback.","All five regional lanes, the full 99-subject registry quick scan, the european_contemporary focus cohort, Monday standing beats and the prior-two-issue lookback were checked; the public radar contains 10 distinct items with at least two per category.","Named editorial, visual and rights review remains unresolved; the owner's current task authorizes the existing non-production Preview only after technical and privacy gates pass."]
}
